<!ELEMENT business (name, gif, sound, items)>
<!ELEMENT name (#PCDATA)>
<!ELEMENT gif (#PCDATA)>
<!ELEMENT sound (#PCDATA)>
<!ELEMENT items (item*)>
<!ELEMENT item (name, price, description)>
<!ELEMENT price (#PCDATA)>
<!ELEMENT description (#PCDATA)>